{
  "id": "openai-codex-e9dc883e98",
  "date": "2026-10-14",
  "vendor": "OpenAI Codex",
  "category": "code",
  "source_id": "openai-codex-releases",
  "title": "0.163.0-alpha.10",
  "summary_zh": "OpenAI Codex 发布 0.163.0-alpha.10，属于 alpha 预览版本。该条目无价格快照，不涉及价格变化。",
  "source_url": "https://github.com/openai/codex/releases/tag/rust-v0.163.0-alpha.10",
  "verified": false,
  "signal_type": "release",
  "fetched_at": "2026-10-15T05:17:10+00:00"
}
