{
  "id": "qwen-code-f4e6bccf4f",
  "date": "2026-10-24",
  "vendor": "阿里 Qwen Code",
  "category": "code",
  "source_id": "qwen-code-releases",
  "title": "Release v0.26.0-nightly.20261023.5a0be33432",
  "summary_zh": "阿里 Qwen Code 发布 v0.26.0-nightly.20261023.5a0be33432（2026-10-24）。该版本新增 serve 守护进程令牌持久化、managed-agent 手动上下文压缩与会话生命周期 UI 及读取导出，并让 CLI 的 OpenTUI 输入、编辑与状态行对齐 Ink；同时修复目录变更后的误中断、发布打包可执行位校验等问题。",
  "source_url": "https://github.com/QwenLM/qwen-code/releases/tag/v0.26.0-nightly.20261023.5a0be33432",
  "verified": false,
  "signal_type": "release",
  "fetched_at": "2026-10-24T01:34:55+00:00"
}
