{
  "id": "windsurf-4c8b61190c",
  "date": "2026-10-24",
  "vendor": "Windsurf",
  "category": "code",
  "source_id": "windsurf-changelog",
  "title": "Devin Desktop / Windsurf v3.11.216",
  "summary_zh": "Windsurf 发布 v3.11.216（2026-10-24），修复了无 Devin Cloud 会话权限的成员无法查看、打开和启动 Devin Local 会话的问题。Windows 上安装 Devin CLI 后无需先退出登录即可在新的终端中使用 devin；macOS 和 Linux 上重复运行安装命令会刷新链接而非失败。此外还修复了终端输出内联图片时 Devin Local 会话崩溃的问题。",
  "source_url": "https://docs.devin.ai/desktop/changelog#v3-11-216",
  "verified": true,
  "signal_type": "changelog",
  "fetched_at": "2026-10-24T01:34:50+00:00"
}
