{
  "id": "openai-codex-a0745b539e",
  "date": "2026-10-15",
  "vendor": "OpenAI Codex",
  "category": "code",
  "source_id": "openai-codex-releases",
  "title": "0.163.0-alpha.10.1",
  "summary_zh": "",
  "source_url": "https://github.com/openai/codex/releases/tag/rust-v0.163.0-alpha.10.1",
  "verified": false,
  "signal_type": "release",
  "fetched_at": "2026-10-15T05:13:17+00:00"
}
