{
  "id": "openai-298c8de07d",
  "date": "2026-10-24",
  "vendor": "OpenAI",
  "category": "agent-platform",
  "source_id": "openai-news",
  "title": "Rapidly scaling online storage to serve over 1 billion ChatGPT users (Part II)",
  "summary_zh": "OpenAI 工程团队发布文章第二部分，介绍其在线存储平台 Habitat 如何通过与 Azure 团队合作，采用共管容器的多租户方案扩展底层 Azure Cosmos DB，以支撑超过 10 亿用户、覆盖 40 个地理区域、服务超过 500 PB 数据的需求。文章回顾了从依赖 Cosmos DB 原语、尝试工作负载隔离与单租户，到默认多租户并具备数据迁移能力的三个阶段，并讨论了热键限流、QoS、无服务器模式、就近存储、缓存与用 Rust 降低代理开销等优化手段。",
  "source_url": "https://openai.com/index/scaling-storage-one-billion-users-part-two",
  "verified": false,
  "signal_type": "changelog",
  "fetched_at": "2026-10-24T01:34:50+00:00"
}
