{
  "id": "anthropic-claude-code-13d5315f51",
  "date": "2026-10-19",
  "vendor": "Anthropic Claude Code",
  "category": "code",
  "source_id": "claude-code-releases",
  "title": "v2.1.303",
  "summary_zh": "Anthropic Claude Code 发布 v2.1.303，本次更新包含缺陷修复与可靠性改进。",
  "source_url": "https://github.com/anthropics/claude-code/releases/tag/v2.1.303",
  "verified": false,
  "signal_type": "release",
  "fetched_at": "2026-10-19T01:15:52+00:00"
}
